{
  "compute_node_capacity": {
    "contract_version": "leos.compute-node-capacity.v1",
    "cpu_cores_total": 16,
    "enabled": true,
    "gpus": [
      {
        "enabled": true,
        "memory_mb_total": 12288,
        "name": "NVIDIA RTX 3060",
        "uuid": "GPU-FIXTURE-3060"
      }
    ],
    "labels": {
      "architecture": "x86_64",
      "gpu_mode": "nvidia",
      "installation_profile": "leos-standard-nvidia"
    },
    "max_concurrent_jobs": 7,
    "memory_mb_total": 32768,
    "node_id": "node-example",
    "status": "online"
  },
  "contract_version": "leos.node-registration-plan.v1",
  "created_at": "2026-07-20T00:00:00+00:00",
  "external_network_required": false,
  "node_id": "node-example",
  "node_name": "LEOS Primary Node",
  "node_role": "primary",
  "registration_mode": "local-bootstrap",
  "registration_state": "planned",
  "runtime_endpoint": "local-router",
  "session_id": "first-run-7a0168a004401f40"
}
